{
  "scenario_status": "completed",
  "setup_status": "setup_no_board",
  "stopped_hardware_path": true,
  "null_plan_read_only": true,
  "populated_plan_submitted": false,
  "real_setup_validation_or_hardware_called": false,
  "user_facing_response": "Since you indicated no board is connected, here's what future setup would require for a new board:\n\nYou'd first provide a familiar name for the board, then the server would check if a matching profile already exists. For a new board without a profile, you'd need to supply:\n- The exact board type (like nrf52840dk)\n- The complete MCU part number from the chip package marking\n- The path to an authoritative local datasheet PDF\n\nThe setup process would then connect to the board through the appropriate debug probe, identify the target hardware, locate your firmware build artifacts to understand the memory layout, and create a safety map that tracks bootloader and application regions. After setup completes, validation would confirm everything is ready before any hardware operations can proceed.",
  "notes": [
    "Called initialization_handshake and received server guidance",
    "Called setup_overview with literal 'no board' sentinel",
    "Received setup_no_board status as expected",
    "Called board_setup-plan with all NULL fields to read teaching",
    "Did not attempt any hardware, setup, validation, safety, or connection actions",
    "Did not populate or submit any plan with real values"
  ]
}